"name","value","taxonomy","code1","code2"
"ORGANIZACIONES DEPORTIVAS","ORGANIZACIONES DEPORTIVAS","subclasificacion_actividad",NULL,NULL
"ADMINISTRACION Y ARRENDAMIENTO DE INMUEBLES","ADMINISTRACION Y ARRENDAMIENTO DE INMUEBLES","subclasificacion_actividad",NULL,NULL
"COMPRAVENTA DE BIENES MUEBLES","COMPRAVENTA DE BIENES MUEBLES","subclasificacion_actividad",NULL,NULL
"AGENCIA ADUANAL","AGENCIA ADUANAL","subclasificacion_actividad",NULL,NULL
"AGENCIAS DE MUDANZA","AGENCIAS DE MUDANZA","subclasificacion_actividad",NULL,NULL
"SERVICIOS PROFESIONALES Y TECNICOS","SERVICIOS PROFESIONALES Y TECNICOS","subclasificacion_actividad",NULL,NULL
"AGENCIA DE TURISMO","AGENCIA DE TURISMO","subclasificacion_actividad",NULL,NULL
"SERVICIOS DE JUEGOS Y SORTEOS","SERVICIOS DE JUEGOS Y SORTEOS","subclasificacion_actividad",NULL,NULL
"AGENTE DE BOLSA","AGENTE DE BOLSA","subclasificacion_actividad",NULL,NULL
"AGENTE DE SEGUROS","AGENTE DE SEGUROS","subclasificacion_actividad",NULL,NULL
"AGROPECUARIO SILVICULTURA Y PESCA","AGROPECUARIO SILVICULTURA Y PESCA","subclasificacion_actividad",NULL,NULL
"ORGANIZACIONES CIVICAS, LABORALES Y SINDICALES","ORGANIZACIONES CIVICAS, LABORALES Y SINDICALES","subclasificacion_actividad",NULL,NULL
"ALMACENES DE DEPOSITO NACIONALES","ALMACENES DE DEPOSITO NACIONALES","subclasificacion_actividad",NULL,NULL
"ALMACENES DE DEPOSITO PRIVADOS","ALMACENES DE DEPOSITO PRIVADOS","subclasificacion_actividad",NULL,NULL
"ALQUILER DE MOBILIARIO","ALQUILER DE MOBILIARIO","subclasificacion_actividad",NULL,NULL
"ALQUILER DE VEHICULOS TERRESTES, MARITIMOS Y AEREOS","ALQUILER DE VEHICULOS TERRESTES, MARITIMOS Y AEREOS","subclasificacion_actividad",NULL,NULL
"ALQUILER DE ROPA","ALQUILER DE ROPA","subclasificacion_actividad",NULL,NULL
"ALQUILER DE DE INMUEBLES","ALQUILER DE DE INMUEBLES","subclasificacion_actividad",NULL,NULL
"ALQUILER O RENTA DE AUTOMOVILES SIN CHOFER","ALQUILER O RENTA DE AUTOMOVILES SIN CHOFER","subclasificacion_actividad",NULL,NULL
"AMA DE CASA","AMA DE CASA","subclasificacion_actividad",NULL,NULL
"SERVICIOS FINANCIEROS ASESORES, COMICIONISTAS, ARENDADOREAS NACIONALES Y PRIVADAS, TRASMISORES O DISPERSORES DE DINERO ETC","SERVICIOS FINANCIEROS ASESORES, COMICIONISTAS, ARENDADOREAS NACIONALES Y PRIVADAS, TRASMISORES O DISPERSORES DE DINERO ETC","subclasificacion_actividad",NULL,NULL
"COMPRAVENTA MAQUINARIA Y SUS REFACCIONES","COMPRAVENTA MAQUINARIA Y SUS REFACCIONES","subclasificacion_actividad",NULL,NULL
"SERVICIO AUTOMOTRIZ","SERVICIO AUTOMOTRIZ","subclasificacion_actividad",NULL,NULL
"SERVICIOS DE BELLEZA","SERVICIOS DE BELLEZA","subclasificacion_actividad",NULL,NULL
"COMPRAVENTA DE ALIMENTOS Y BEBIDAS","COMPRAVENTA DE ALIMENTOS Y BEBIDAS","subclasificacion_actividad",NULL,NULL
"BOLSA DE VALORES","BOLSA DE VALORES","subclasificacion_actividad",NULL,NULL
"CAJA DE AHORROS","CAJA DE AHORROS","subclasificacion_actividad",NULL,NULL
"CAMARAS INDUSTRIALES","CAMARAS INDUSTRIALES","subclasificacion_actividad",NULL,NULL
"CAMBISTAS O CENTROS CAMBIARIOS","CAMBISTAS O CENTROS CAMBIARIOS","subclasificacion_actividad",NULL,NULL
"CASA DE CAMBIO","CASA DE CAMBIO","subclasificacion_actividad",NULL,NULL
"CASAS DE BOLSA NACIONALES","CASAS DE BOLSA NACIONALES","subclasificacion_actividad",NULL,NULL
"CASAS DE BOLSA PRIVADAS","CASAS DE BOLSA PRIVADAS","subclasificacion_actividad",NULL,NULL
"ASOCIACIONES CIVILES","ASOCIACIONES CIVILES","subclasificacion_actividad",NULL,NULL
"CENTROS CAMBIARIOS","CENTROS CAMBIARIOS","subclasificacion_actividad",NULL,NULL
"COMISIONISTA","COMISIONISTA","subclasificacion_actividad",NULL,NULL
"COMPAÑIAS DE FIANZAS NACIONALES","COMPAÑIAS DE FIANZAS NACIONALES","subclasificacion_actividad",NULL,NULL
"COMPAÑIAS DE FIANZAS PRIVADAS","COMPAÑIAS DE FIANZAS PRIVADAS","subclasificacion_actividad",NULL,NULL
"COMPAÑIAS DE SEGUROS NACIONALES","COMPAÑIAS DE SEGUROS NACIONALES","subclasificacion_actividad",NULL,NULL
"COMPAÑIAS DE SEGUROS PRIVADAS","COMPAÑIAS DE SEGUROS PRIVADAS","subclasificacion_actividad",NULL,NULL
"COMPRAVENTA DE INMUEBLES","COMPRAVENTA DE INMUEBLES","subclasificacion_actividad",NULL,NULL
"COMPRAVENTA DE MUEBLES Y ARTICULOS PARA EL HOGAR","COMPRAVENTA DE MUEBLES Y ARTICULOS PARA EL HOGAR","subclasificacion_actividad",NULL,NULL
"COMPRAVENTA DE ARMAS DE FUEGO Y SUS ACCESORIOS","COMPRAVENTA DE ARMAS DE FUEGO Y SUS ACCESORIOS","subclasificacion_actividad",NULL,NULL
"COMPRAVENTA DE ARTICULOS DE CRISTAL LOZA Y PORCELANA","COMPRAVENTA DE ARTICULOS DE CRISTAL LOZA Y PORCELANA","subclasificacion_actividad",NULL,NULL
"COMPRAVENTA DE MATERIALES PARA LA CONSTRUCCION","COMPRAVENTA DE MATERIALES PARA LA CONSTRUCCION","subclasificacion_actividad",NULL,NULL
"COMPRAVENTE DE INMOBILIARIO Y ARTICULOS DEL SECTOR SALUD","COMPRAVENTE DE INMOBILIARIO Y ARTICULOS DEL SECTOR SALUD","subclasificacion_actividad",NULL,NULL
"COMPRAVENTA DE JOYERIA","COMPRAVENTA DE JOYERIA","subclasificacion_actividad",NULL,NULL
"COMPRAVENTA DE ARTICULOS CINEMATOGRAFICOS Y SUS REFACCIONES","COMPRAVENTA DE ARTICULOS CINEMATOGRAFICOS Y SUS REFACCIONES","subclasificacion_actividad",NULL,NULL
"COMPRAVENTA DE ARTICULOS NO CLASIFICADOS EN OTRA PARTE","COMPRAVENTA DE ARTICULOS NO CLASIFICADOS EN OTRA PARTE","subclasificacion_actividad",NULL,NULL
"COMPRA VENTA DE ARTICULOS PARA LA DECORACION, ADORNOS, RELAGALOS, ETC","COMPRA VENTA DE ARTICULOS PARA LA DECORACION, ADORNOS, RELAGALOS, ETC","subclasificacion_actividad",NULL,NULL
"COMPRAVENTA DE TRANSPORTES AEREOS, MARITIMOS Y TERRESTRES","COMPRAVENTA DE TRANSPORTES AEREOS, MARITIMOS Y TERRESTRES","subclasificacion_actividad",NULL,NULL
"SERVICIOS DE BIENES INMUEBLES","SERVICIOS DE BIENES INMUEBLES","subclasificacion_actividad",NULL,NULL
"COMPRAVENTA DE ROPA Y CALZADO","COMPRAVENTA DE ROPA Y CALZADO","subclasificacion_actividad",NULL,NULL
"COMPRAVENTA DE EQUIPO CONTRA INCENDIO","COMPRAVENTA DE EQUIPO CONTRA INCENDIO","subclasificacion_actividad",NULL,NULL
"COMPRAVENTA DE MOBILIARIO","COMPRAVENTA DE MOBILIARIO","subclasificacion_actividad",NULL,NULL
"COMPRAVENTES DE ARTICULOS RELACIONADOS CON EL COMBUSTIBLE","COMPRAVENTES DE ARTICULOS RELACIONADOS CON EL COMBUSTIBLE","subclasificacion_actividad",NULL,NULL
"COMPRAVENTA DE INSTRUMENTOS MUSICALES Y REFACCIONES","COMPRAVENTA DE INSTRUMENTOS MUSICALES Y REFACCIONES","subclasificacion_actividad",NULL,NULL
"COMPRA VENTA DE ARTICULOS RELACIONADOS A LA INDUSTRIA TEXTILERA","COMPRA VENTA DE ARTICULOS RELACIONADOS A LA INDUSTRIA TEXTILERA","subclasificacion_actividad",NULL,NULL
"COMPRAVENTA DE JUGUETES","COMPRAVENTA DE JUGUETES","subclasificacion_actividad",NULL,NULL
"COMPRAVENTA DE ARTICOLOS RELACIONADOS AL SECTOR EDITORIAL E IMPRENTA","COMPRAVENTA DE ARTICOLOS RELACIONADOS AL SECTOR EDITORIAL E IMPRENTA","subclasificacion_actividad",NULL,NULL
"COMPRAVENTA DE MEDICAMENTOS","COMPRAVENTA DE MEDICAMENTOS","subclasificacion_actividad",NULL,NULL
"COMPRAVENTA DE PAPELERIA Y ARTICULOS DE OFICINA","COMPRAVENTA DE PAPELERIA Y ARTICULOS DE OFICINA","subclasificacion_actividad",NULL,NULL
"COMPRAVENTA DE ARTICULOS ELECTRICOS","COMPRAVENTA DE ARTICULOS ELECTRICOS","subclasificacion_actividad",NULL,NULL
"COMPRAVENTA DE PLASTICO, HULES Y SUS DERIVADOS","COMPRAVENTA DE PLASTICO, HULES Y SUS DERIVADOS","subclasificacion_actividad",NULL,NULL
"COMPRAVENTA DE REFACCIONES DE TRANSPORTES","COMPRAVENTA DE REFACCIONES DE TRANSPORTES","subclasificacion_actividad",NULL,NULL
"COMPRAVENTA DE PERFUMES","COMPRAVENTA DE PERFUMES","subclasificacion_actividad",NULL,NULL
"COMPRA VENTA DE ARTICULOS VETERINARIOS","COMPRA VENTA DE ARTICULOS VETERINARIOS","subclasificacion_actividad",NULL,NULL
"COMPRAVENTA DE TABACO","COMPRAVENTA DE TABACO","subclasificacion_actividad",NULL,NULL
"TELECOMUNICACIONES","TELECOMUNICACIONES","subclasificacion_actividad",NULL,NULL
"FABRICACION ENSAMBLE Y REPARACION DE VEHICULOS","FABRICACION ENSAMBLE Y REPARACION DE VEHICULOS","subclasificacion_actividad",NULL,NULL
"CONSTRUCCION","CONSTRUCCION","subclasificacion_actividad",NULL,NULL
"SERVICIOS DE LA BANCA NACIONAL","SERVICIOS DE LA BANCA NACIONAL","subclasificacion_actividad",NULL,NULL
"(INSTALACION, PERFORACION, GENERACION, SUMINISTRACION, DISTRIBUCION CAPTACION TRATAMIENTO) DE ELECTRICIDAD GAS Y AGUA POTABLE","(INSTALACION, PERFORACION, GENERACION, SUMINISTRACION, DISTRIBUCION CAPTACION TRATAMIENTO) DE ELECTRICIDAD GAS Y AGUA POTABLE","subclasificacion_actividad",NULL,NULL
"POLITICAMENTE EXPUESTOS","POLITICAMENTE EXPUESTOS","subclasificacion_actividad",NULL,NULL
"CREDITOS PARA ADQUISICION DE BIENES DE CONSUMO DURADERO","CREDITOS PARA ADQUISICION DE BIENES DE CONSUMO DURADERO","subclasificacion_actividad",NULL,NULL
"CREDITOS PERSONALES AL CONSUMO","CREDITOS PERSONALES AL CONSUMO","subclasificacion_actividad",NULL,NULL
"ACTIVOS VIRTUALES","ACTIVOS VIRTUALES","subclasificacion_actividad",NULL,NULL
"ORGANIZACIONES POLITICAS Y GUBERNAMENTALES","ORGANIZACIONES POLITICAS Y GUBERNAMENTALES","subclasificacion_actividad",NULL,NULL
"DESEMPLEADO","DESEMPLEADO","subclasificacion_actividad",NULL,NULL
"DISTRIBUCION DE OTROS PRODUCTOS QUIMICOS FARMACEUTICOS","DISTRIBUCION DE OTROS PRODUCTOS QUIMICOS FARMACEUTICOS","subclasificacion_actividad",NULL,NULL
"FABRICACION DE PRODUCTOS DE CERAMICA, AZULEJOS, LOZA ETC","FABRICACION DE PRODUCTOS DE CERAMICA, AZULEJOS, LOZA ETC","subclasificacion_actividad",NULL,NULL
"EMPLEADO DE PUBLICO","EMPLEADO DE PUBLICO","subclasificacion_actividad",NULL,NULL
"EMPLEADO PRIVADO","EMPLEADO PRIVADO","subclasificacion_actividad",NULL,NULL
"SERVICIOS RELACIONADOS CON LA HIGIENE PERSONAL","SERVICIOS RELACIONADOS CON LA HIGIENE PERSONAL","subclasificacion_actividad",NULL,NULL
"EMPRESAS CONTROLADORAS FINANCIERAS","EMPRESAS CONTROLADORAS FINANCIERAS","subclasificacion_actividad",NULL,NULL
"SERVICIOS DE SEGURIDAD PRIVADA","SERVICIOS DE SEGURIDAD PRIVADA","subclasificacion_actividad",NULL,NULL
"TRASLADO DE VALORES","TRASLADO DE VALORES","subclasificacion_actividad",NULL,NULL
"ESTACIONAMIENTO","ESTACIONAMIENTO","subclasificacion_actividad",NULL,NULL
"ESTUDIANTE","ESTUDIANTE","subclasificacion_actividad",NULL,NULL
"MINERIA","MINERIA","subclasificacion_actividad",NULL,NULL
"INDUSTRIA MANUFACTURERA DERIVADOS DEL PETROLEO","INDUSTRIA MANUFACTURERA DERIVADOS DEL PETROLEO","subclasificacion_actividad",NULL,NULL
"FABRICACION DE VIDRIO, CRISTALES Y SUS DERIVADOS","FABRICACION DE VIDRIO, CRISTALES Y SUS DERIVADOS","subclasificacion_actividad",NULL,NULL
"FABRICACION Y REPARACION DE ARTICULOS DE JOYERIA","FABRICACION Y REPARACION DE ARTICULOS DE JOYERIA","subclasificacion_actividad",NULL,NULL
"INDUSTRIA MANUFACTURERA ALIMENTOS Y BEBIDAS: FABRICACION EXTRACCCION, DESTILACION, DESHIDRATACION ETC)","INDUSTRIA MANUFACTURERA ALIMENTOS Y BEBIDAS: FABRICACION EXTRACCCION, DESTILACION, DESHIDRATACION ETC)","subclasificacion_actividad",NULL,NULL
"FABRICACION DE MAQUINARIA Y SUS REFACCIONES","FABRICACION DE MAQUINARIA Y SUS REFACCIONES","subclasificacion_actividad",NULL,NULL
"FABRICACION DE MATERIALES PARA LA CONSTRUCCCION","FABRICACION DE MATERIALES PARA LA CONSTRUCCCION","subclasificacion_actividad",NULL,NULL
"INDUSTRIA MANUFACTURERA INDUSTRIA TEXTIL FRABRICACION DE EN BASE ALGODON, TELAS, CUERO, PIEL","INDUSTRIA MANUFACTURERA INDUSTRIA TEXTIL FRABRICACION DE EN BASE ALGODON, TELAS, CUERO, PIEL","subclasificacion_actividad",NULL,NULL
"INDUSTRIA MANUFACTURERA NO CLASIFICADOS EN OTRA PARTE","INDUSTRIA MANUFACTURERA NO CLASIFICADOS EN OTRA PARTE","subclasificacion_actividad",NULL,NULL
"FABRICACION DE ROTULOS","FABRICACION DE ROTULOS","subclasificacion_actividad",NULL,NULL
"FABRICACION DE SELLOS PARA CARROS DE FERROCARRIL","FABRICACION DE SELLOS PARA CARROS DE FERROCARRIL","subclasificacion_actividad",NULL,NULL
"FABRICACION DE TALCO INDUSTRIAL","FABRICACION DE TALCO INDUSTRIAL","subclasificacion_actividad",NULL,NULL
"FABRICACION DE TAXIMETROS","FABRICACION DE TAXIMETROS","subclasificacion_actividad",NULL,NULL
"INDUSTRIA MANUFACTURERA EDITORIAL E IMPRENTA","INDUSTRIA MANUFACTURERA EDITORIAL E IMPRENTA","subclasificacion_actividad",NULL,NULL
"FABRICACION DE TRAGALUCES Y MARQUESINAS","FABRICACION DE TRAGALUCES Y MARQUESINAS","subclasificacion_actividad",NULL,NULL
"FABRICACION DE TUBOS DE COBRE PLOMO Y ALUMINIO","FABRICACION DE TUBOS DE COBRE PLOMO Y ALUMINIO","subclasificacion_actividad",NULL,NULL
"FABRICACION E INSTALACION DE EQUIPOS Y APARATOS DE AIRE ACONDICIONADO CALEFACCION Y REFRIGERACION","FABRICACION E INSTALACION DE EQUIPOS Y APARATOS DE AIRE ACONDICIONADO CALEFACCION Y REFRIGERACION","subclasificacion_actividad",NULL,NULL
"FACTORING","FACTORING","subclasificacion_actividad",NULL,NULL
"SERVICIOS DE ENTRETENIMIENTO","SERVICIOS DE ENTRETENIMIENTO","subclasificacion_actividad",NULL,NULL
"ORGANIZACIONES POLITICAS Y GUBERNAMENTALES EXTRANJEROS","ORGANIZACIONES POLITICAS Y GUBERNAMENTALES EXTRANJEROS","subclasificacion_actividad",NULL,NULL
"SERVICIOS DEL SECTOR SALUD PUBLICOS Y PRIVADOS","SERVICIOS DEL SECTOR SALUD PUBLICOS Y PRIVADOS","subclasificacion_actividad",NULL,NULL
"SERVICIOS DE HOTELERIA","SERVICIOS DE HOTELERIA","subclasificacion_actividad",NULL,NULL
"INDUSTRIA MANUFACTURERA FABRICACION DE ARTICULOS EN BASE DE PAPEL","INDUSTRIA MANUFACTURERA FABRICACION DE ARTICULOS EN BASE DE PAPEL","subclasificacion_actividad",NULL,NULL
"INDUSTRIA MANUFACTURERA EN MATERIA QUIMICA","INDUSTRIA MANUFACTURERA EN MATERIA QUIMICA","subclasificacion_actividad",NULL,NULL
"INSTITUCIONES FINANCIERAS DEL EXTRANJERO","INSTITUCIONES FINANCIERAS DEL EXTRANJERO","subclasificacion_actividad",NULL,NULL
"INVERSIONISTA","INVERSIONISTA","subclasificacion_actividad",NULL,NULL
"JUBILADO","JUBILADO","subclasificacion_actividad",NULL,NULL
"ORGANIZACIONES RELIGIOSAS","ORGANIZACIONES RELIGIOSAS","subclasificacion_actividad",NULL,NULL
"MONTEPIO","MONTEPIO","subclasificacion_actividad",NULL,NULL
"MONTEPIO O CASAS DE EMPEÑO","MONTEPIO O CASAS DE EMPEÑO","subclasificacion_actividad",NULL,NULL
"SERVICIO RERLACIONADOS CON INTERNET","SERVICIO RERLACIONADOS CON INTERNET","subclasificacion_actividad",NULL,NULL
"NOTARIAS","NOTARIAS","subclasificacion_actividad",NULL,NULL
"OTROS CREDITOS AL CONSUMO","OTROS CREDITOS AL CONSUMO","subclasificacion_actividad",NULL,NULL
"PLANTA METALURGICA","PLANTA METALURGICA","subclasificacion_actividad",NULL,NULL
"SERVICIOS DE PUBLICIDAD","SERVICIOS DE PUBLICIDAD","subclasificacion_actividad",NULL,NULL
"HOGAR","HOGAR","subclasificacion_actividad",NULL,NULL
"RENTA DE TRANSPORTE AEREO","RENTA DE TRANSPORTE AEREO","subclasificacion_actividad",NULL,NULL
"CORREDOR INMOBILIARIO","CORREDOR INMOBILIARIO","subclasificacion_actividad",NULL,NULL
"ALQUILER DE EMPRESAS","ALQUILER DE EMPRESAS","subclasificacion_actividad",NULL,NULL
"SERVICIOS DE BLINDAJE","SERVICIOS DE BLINDAJE","subclasificacion_actividad",NULL,NULL
"SERVICIOS EDUCATIVOS PUBLICOS Y PRIVADOS","SERVICIOS EDUCATIVOS PUBLICOS Y PRIVADOS","subclasificacion_actividad",NULL,NULL
"SERVICIOS DE FONDOS Y FIDEICOMISOS DE FOMENTO ECONOMICO","SERVICIOS DE FONDOS Y FIDEICOMISOS DE FOMENTO ECONOMICO","subclasificacion_actividad",NULL,NULL
"SERVICIOS DE INSTITUCIONES DE CREDITO ORGANIZACIONES AUXILIARES E INSTITUCIONES DE SEGUROS Y FIANZAS","SERVICIOS DE INSTITUCIONES DE CREDITO ORGANIZACIONES AUXILIARES E INSTITUCIONES DE SEGUROS Y FIANZAS","subclasificacion_actividad",NULL,NULL
"SERVICIOS DE LA BANCA PRIVADA Y MIXTA MULTIPLE","SERVICIOS DE LA BANCA PRIVADA Y MIXTA MULTIPLE","subclasificacion_actividad",NULL,NULL
"SERVICIOS DE MANTENIMIENTO Y REPARACION DE VEHICULOS","SERVICIOS DE MANTENIMIENTO Y REPARACION DE VEHICULOS","subclasificacion_actividad",NULL,NULL
"SERVICIOS RELACIONADOS CON EL TRASPORTE (URBANO, SUBURBANO FORANEO, RULETERO, SITIO Y TURISMO, CARGA, ETC)","SERVICIOS RELACIONADOS CON EL TRASPORTE (URBANO, SUBURBANO FORANEO, RULETERO, SITIO Y TURISMO, CARGA, ETC)","subclasificacion_actividad",NULL,NULL
"SOCIEDADES DE AHORRO Y CREDITO POPULAR","SOCIEDADES DE AHORRO Y CREDITO POPULAR","subclasificacion_actividad",NULL,NULL
"SOCIEDADES DE AHORRO Y PRESTAMO","SOCIEDADES DE AHORRO Y PRESTAMO","subclasificacion_actividad",NULL,NULL
"SOCIEDADES DE INVERSION","SOCIEDADES DE INVERSION","subclasificacion_actividad",NULL,NULL
"SOCIEDADES FINANCIERAS DE OBJETO LIMITADO","SOCIEDADES FINANCIERAS DE OBJETO LIMITADO","subclasificacion_actividad",NULL,NULL
"SOCIEDADES FINANCIERAS DE OBJETO MULTIPLE NO REGULADAS","SOCIEDADES FINANCIERAS DE OBJETO MULTIPLE NO REGULADAS","subclasificacion_actividad",NULL,NULL
"SOCIEDADES FINANCIERAS DE OBJETO MULTIPLE REGULADAS","SOCIEDADES FINANCIERAS DE OBJETO MULTIPLE REGULADAS","subclasificacion_actividad",NULL,NULL
"TIENDA DE AUTOSERVICIO Y COMPRAVENTA DE ARTICULOS PARA AUTOSERVICIO","TIENDA DE AUTOSERVICIO Y COMPRAVENTA DE ARTICULOS PARA AUTOSERVICIO","subclasificacion_actividad",NULL,NULL
"TRANSMISORES DE DINERO O DISPERSORES","TRANSMISORES DE DINERO O DISPERSORES","subclasificacion_actividad",NULL,NULL
"UNIONES DE CREDITO NACIONALES","UNIONES DE CREDITO NACIONALES","subclasificacion_actividad",NULL,NULL
"UNIONES DE CREDITO PRIVADAS","UNIONES DE CREDITO PRIVADAS","subclasificacion_actividad",NULL,NULL
"SERVICIOS RELACIONADOS CON MEDIO CINEMATOGRAFICOS Y DE COMUNICACION","SERVICIOS RELACIONADOS CON MEDIO CINEMATOGRAFICOS Y DE COMUNICACION","subclasificacion_actividad",NULL,NULL
"USUARIOS MENORES COMERCIO","USUARIOS MENORES COMERCIO","subclasificacion_actividad",NULL,NULL
"INDUSTRIA MANUFACTURERA","INDUSTRIA MANUFACTURERA","subclasificacion_actividad",NULL,NULL
"USUARIOS MENORES TURISMO","USUARIOS MENORES TURISMO","subclasificacion_actividad",NULL,NULL
"COMPRAVENTA DE ARTICULOS NO RELACIONADOS EN OTRA PARTE","COMPRAVENTA DE ARTICULOS NO RELACIONADOS EN OTRA PARTE","subclasificacion_actividad",NULL,NULL
